<!ELEMENT menu (category+)>
<!ELEMENT category (item+)>
<!ATTLIST category title CDATA #REQUIRED>
<!ELEMENT item (name, price, description, image, alt)>
<!ELEMENT name (#PCDATA)>
<!ELEMENT price (#PCDATA)>
<!ELEMENT description (#PCDATA)>
<!ELEMENT image (#PCDATA)>
<!ELEMENT alt (#PCDATA)>
